{
  "$schema": "http://json-schema.org/draft-07/schema#",
  "title": "MBL Material",
  "type": "object",
  "required": ["type", "name", "tags", "density", "color"],
  "properties": {
    "type": { "const": "material" },
    "name": { "type": "string" },
    "description": { "type": "string" },
    "color": {
      "oneOf": [
        { "type": "string" },
        {
          "type": "array",
          "minItems": 3,
          "maxItems": 4,
          "items": { "type": "integer", "minimum": 0, "maximum": 255 }
        }
      ]
    },
    "density": { "type": "number", "minimum": 0 },
    "tags": {
      "type": "array",
      "minItems": 1,
      "items": {
        "type": "string",
        "enum": [
          "sand",
          "flow",
          "float",
          "static",
          "water",
          "fire",
          "flammable",
          "reactive_water",
          "explosive",
          "burns_out",
          "smoke",
          "steam",
          "mud",
          "seed",
          "plant",
          "grow",
          "dirt",
          "element",
          "source",
          "drain"
        ]
      }
    },
    "reactions": {
      "type": "array",
      "items": {
        "type": "object",
        "required": ["with", "result"],
        "properties": {
          "with": { "type": "string" },
          "result": { "type": "string" },
          "byproduct": { "type": "string" },
          "probability": { "type": "number", "minimum": 0, "maximum": 1 },
          "priority": { "type": "number" }
        }
      }
    },
    "condense": {
      "type": "object",
      "required": ["at", "result"],
      "properties": {
        "at": { "type": "string", "enum": ["top"] },
        "result": { "type": "string" },
        "probability": { "type": "number", "minimum": 0, "maximum": 1 }
      }
    }
  }
}
